Top100Year,SongTitle,Artist,LyricsStatus,Lyrics,ReleaseYear,Genre
2023,PRC,Peso Pluma X Natanael Cano,True,"Me levanto, un baño y luego me pongo a forjar
Es veneno, da pa'rriba, de muy buena calidad
Los teléfonos no paran nunca de sonar
Si no es alguna plebita, es porque un cliente quiere más
Y bien forrados los paquetes van
No hay pendiente, no puedo fallar
Siempre estoy listo para cruzar
Polvo, ruedas y también cristal
Aquí el papelito viene y va
Las morritas bien locas se van
Disfrutamos, esté bien o mal
De esta vida no me vo'a quejar
¡Ea!, y bien jalados con La Doble P
Los corridos tumbados
Así nomás, viejo
Fino con las Balenciaga
Corridos bien vergas sonaban
Las morritas muy bien bailaban
Y yo ando Silver LV
Siento que ando volando ya, carnal
Y aquí nunca nos vamos a quejar
¿Para qué vamos a voltear pa'trás?
Ni pedo yo le vo'a atorar
Bien forrados los paquetes van
No hay pendiente, no puedo fallar
Siempre estoy listo para cruzar
Polvo, ruedas y también cristal
Y bien forrados los paquetes van
No hay pendiente, no puedo fallar
Siempre estoy listo para cruzar
Polvo, ruedas y también cristal
Translate to English",2023,"Latin Urbano, R&B/Soul, Hip-Hop/Rap"
2023,Por Las Noches,Peso Pluma,True,"Cuando por las noches recordaba todo
El olor de aquel perfume sobre todo
Las sábanas blancas donde te escondías dentro
Eres intocable como joya de oro
Esas piernas largas comerme yo solo
Y tus ojos grandes, me perdí en un laberinto
Y pensar
Que tú ya no vas a estar
Pasará
Solito me dejará
Intentar
Solo un beso y tú te vas
De mi vida-ah-ah
Como tú no hay nadie más
No hay nadie más
Ah
¿Y qué?
Si te sientes sola no me llames porfa
Me pongo sensible, me imagino tu sombra
Clase Azul es el tequila e interior la ropa
Rico Prat champaña, el polvo es color rosa
Me contactó un ángel, eres tú mi hermosa
La que me alegra los días y sigo tomando
Y pensar
Que tú ya no vas a estar
Pasará
Solito me dejará
Intentar
Solo un beso y tú te vas
De mi vida-ah-ah
Como tú no hay nadie más
No hay nadie más
Translate to English",2021,"Latin Urbano, R&B/Soul, Hip-Hop/Rap"
2023,Mourning,Post Malone,True,"Don't want to sober up
The sun is killing my buzz, that's why they call it mourning
Thought I was strong enough
Threw my bottle at the sky, said, ""God that's a warning""
Don't want to sober up
Try to keep it inside, but I just want to pour it
Thought I was strong enough
Got a lot of shit to say, couldn't fit it in the chorus
I just left Wally's in a Maserati
The way I gotta flex you'd think I did pilates
I called my quote and quote friends, do you got plans?
Turns out everyone's free when the dinner is
Then they drag me to a party out in Malibu
After thirty High Noons it was pretty cool
Tried to shoot my shot, she told me that she had a shoot, bye-bye (damn)
Don't want to sober up
The sun is killing my buzz, that's why they call it mourning
Thought I was strong enough
Threw my bottle at the sky, said, ""God that's a warning""
Don't want to sober up
Try to keep it inside, but I just want to pour it
Thought I was strong enough
Got a lot of shit to say, couldn't fit it in the chorus
Stumbling down a corridor, came across an open door
Throwing up is easy and who put on The Commodores?
That's a nice tile floor, wish I got to know you more
Who am I talking to? Nobody
Take me outside, I'm a little too high
Paid a little too much for the time of my life
When money ain't a problem, everyone's sliding
Even when I tell myself that I
Don't want to sober up
The sun is killing my buzz, that's why they call it mourning
Thought I was strong enough
Threw my bottle at the sky, said, ""God that's a warning""
Don't want to sober up
Try to keep it inside, but I just want to pour it
Thought I was strong enough
Got a lot of shit to say, couldn't fit it in the chorus",2023,"Latin Urbano, R&B/Soul, Hip-Hop/Rap"
2023,Am I Dreaming,"Metro Boomin, A$AP Rocky & Roisee",True,"Not done fightin', I don't feel I've lost
Am I dreamin', is there more like us?
Got me feeling like it's all too much
I feel beaten, but I can't give up
I'm still fightin' (Metro), I don't feel I've lost
Am I dreamin', is there more like us?
Got me feelin' like it's all too much
I feel beaten, but I can't give up
Uh, wakin' up, feelin' like the thankful one
Count up my ones, lacin' up my favorite 1's
One of a kind, one of one, the only one
Got one shot and one chance to take it once
Kiss my mama on the forehead, 'fore I get the code red
'Cause I was born, bred to go in, toast red
And swing by four-ten, beef patty, cornbread
In the concrete jungle, where my home is (no way)
All get focused, all range of toast is
The nickname, Mr. Keen-To-Do-the-Mostest
I was livin' down bad in my folks crib
Now I'm laughin' to the bank and the joke is (no way)
Did more things than folks did or folks get
We've been gettin' this fly since some poor kids
My rich friends and my broke friends co-exist
They love to mix and we know what it is
Not done fightin' (no way), I don't fear I've lost
Am I dreamin', is there more like us?
Got me feeling (no way), like it's all too much
I feel beaten, but I can't give up
I'm still fighting (no way), I don't fear I've lost
Am I dreamin', is there more like us?
Got me feelin' (no way), like it's all too much
I feel beaten (no way), but I can't give up
I can't find it in myself to just walk away
I can't find it in myself to lose everything
Feel everyone's against me, don't want me to be great
Things might look bad, I'm afraid to look death in the face
I'm good now (now, now, no way), who's really bad?
I choose me now (now, now) what's wrong with that?
Wish you could see me (no way)
Now, now, mm, who had my back, baby?
Know no love lost, good always will win
Not done fightin' (no way, fightin'), I don't fear I've lost (feel I-)
Am I dreamin' (dreamin'), is there more like us? (More like)
Got me feeling (no way, feelin'), like it's all too much
I feel beaten (beaten), but I can't give up (can't give-)
I'm still fighting (no way), I don't fear I've lost
Am I dreamin', is there more like us?
Got me feelin' (no way), like it's all too much
I feel beaten (no way), but I can't give up
Can't give up
Can't give, can't give up
Can't give, can't give up
Can't give, can't give up
Can't give up",2023,"Latin Urbano, R&B/Soul, Hip-Hop/Rap"
2023,Waffle House,Jonas Brothers,True,"We never knew how to forfeit (hey now)
But we always knew how to talk sh- (hey now)
Couple nights, threw gasoline on the fire (hey) (hey now)
We never knew how to perfect (hey now)
But we always knew it would work
'Cause if something misread
Or if something got said
Know before the night ends
No, don't get stressed, it's gon' get figured out
Oh, deep conversations at the Waffle House
Headstrong father and a determined mother
Oh, that's why some nights we tried to kill each other
But you know it's always love (hey now)
We never knew how to fake it (hey now)
But we always knew how to break sh- (hey now)
Couple nights, threw gasoline on the fire
'Cause if something misread
Or if something got said
Know before the night ends
No, don't get stressed, it's gon' get figured out
Oh, deep conversations at the Waffle House
Headstrong father and a determined mother
Oh, that's why some nights we tried to kill each other
But you know it's always love
Na-na-na (oh, yeah)
La-la-la-la (but you know it's only love)
Na-na-na (oh, baby)
La-la-la-la
But you know it's always gon' get figured out
Deep conversations at the Waffle House
Headstrong father and a determined mother
Oh, that's why some nights we tried to kill each other
You know it's only love
Na-na-na (oh, yeah)
La-la-la-la (you know it's only love)
Na-na-na (hey)
La-la-la-la (you know it's only love)
Na-na-na (it's always love)
La-la-la-la",2023,"Latin Urbano, R&B/Soul, Hip-Hop/Rap"
2023,See You Again,"Tyler, The Creator Featuring Kali Uchis",False,,2017,"Latin Urbano, R&B/Soul, Hip-Hop/Rap"
2023,TQG,Karol G x Shakira,True,"La que te dijo que un vacío se llena
Con otra persona te miente
Es como tapar una herida con maquillaje
No se ve, pero se siente
Te fuiste diciendo que me superaste (ey)
Y te conseguiste nueva novia (novia)
Lo que ella no sabe es que tú todavía (oh)
Me está' viendo toa' la' historia' (papi)
Bebé, ¿qué fue?
¿No pues que muy tragadito?
¿Qué haces buscándome el la'o
Si sabes que yo errores no repito? (Eh, papi)
Dile a tu nueva bebé
Que por hombres no compito
Que deje de estar tirando
Que al meno' yo te tenía bonito
Verte con la nueva me dolió (dolió)
Pero ya estoy puesta pa' lo mío
Lo que vivimos se me olvidó
Y eso e' lo que te tiene ofendido
Que hasta la vida me mejoró
Por acá ya no eres bienvenido
Vi lo que tu novia me tiró
Eso no da ni rabia, yo me río, yo me río
No tengo tiempo pa' lo que no aporte, ya cambié mi norte
Haciendo dinero como deporte (ah)
Llenando la cuenta, los show', el parking y el pasaporte (ey)
'Toy más dura dicen los reporte'
Ahora tú quieres volver, se te nota, mmm, sí
'Pérame ahí, que yo soy idiota (ah)
Se te olvidó que estoy en otra
Y que te quedó grande La Bichota
Bebé, ¿qué fue? (Fue)
¿No pues que muy tragadito? (Ah)
¿Qué haces buscándome el la'o (ey)
Si sabes que yo errores no repito?
Dile a tu nueva bebé
Que por hombres no compito
Que deje de estar tirando
Que al meno' yo te tenía bonito (Shakira, Shakira)
Tú te fuiste y yo me puse triple M
Más buena, más dura, más level
Volver contigo never, tú eres la mala suerte
Porque ahora la' bendicione' me llueven
Y quiere' volver, ya lo suponía
Dándole like a la foto mía
Tú buscando por fuera la comida
Yo diciendo que era monotonía
Y ahora quieres volver, ya lo suponía
Dándole like a la foto mía (a la mía)
Te ves feliz con tu nueva vida pero
Si ella supiera que me busca' todavía
Bebé, ¿qué fue? (Fue)
¿No pues que muy tragadito? (Ah)
¿Qué haces buscándome el la'o (ey)
Si sabes que yo errores no repito?
Dile a tu nueva bebé
Que por hombres no compito (mueve el culito)
Que no tiene buena mano
Y al menos yo te tenía bonito
Translate to English",2023,"Reggaeton, Latin Urbano, Alternative/Indie, R&B/Soul, Dance/Electronic, Pop, UK R&B, Hip-Hop/Rap, Rock, Country"
2023,Your Heart Or Mine,Jon Pardi,True,"All it takes is a downtown bar
All it takes is some neon stars
A little you, a little me
In the same vicinity, and it's on
Every one is the first last time
Walk away then we hit rewind
A little touch, a little buzz
Don't know what keeps keepin' it up
Is it your heart or mine?
Is it whiskey or wine?
Is it somethin' in the night
Makin' us wanna cross that line?
Girl, we're playin' with fire
Love ain't too far behind
It's just a matter of time 'til it finds
Your heart or mine
We say that it ain't no thing
We say it, then the telephone rings
A, ""Hello, are you at home?
'Cause I'm all alone missin' you""
We swear it ain't love, love, love
But you're there when the sun comes up
We swear it ain't love, love, love
But it always comes back to us
Is it your heart or mine?
Is it whiskey or wine?
Is it somethin' in the night
Makin' us wanna cross that line?
Girl, we're playin' with fire
Love ain't too far behind
It's just a matter of time 'til it finds
Your heart or mine
We swear it ain't love, love, love
We swear it ain't love, love, love
Is it your heart or mine?
Is it whiskey or wine?
Is it somethin' in the night
Makin' us wanna cross that line?
Girl, we're playin' with fire
Love ain't too far behind
It's just a matter of time 'til it finds
Your heart or mine
Your heart or mine",2022,"Reggaeton, Latin Urbano, Alternative/Indie, R&B/Soul, Dance/Electronic, Pop, UK R&B, Hip-Hop/Rap, Rock, Country"
2023,Peaches & Eggplants,Young Nudy Featuring 21 Savage,True,"This how it sound when I hit your ho
Be like this, it be like this, it be like this
I get b-, I get behind your ho and then I be like this, I be like this (COUPE)
What you doin' slime? (Boaw, boaw, boaw, boaw, boaw, boaw)
Dig in that pussy (boaw, boaw, boaw, boaw, boaw, boaw)
Beat her back down (boaw, boaw, boaw, boaw, boaw, boaw)
What we doin'? (Boaw, boaw, boaw, boaw, boaw, boaw)
Boaw, boaw, boaw, boaw, boaw, boaw, in your ho, yeah
Boaw, boaw, boaw, boaw, boaw, boaw, in your ho
Boaw, boaw, boaw, boaw, boaw, boaw, in your ho, yeah
Boaw, boaw, boaw, boaw, boaw, boaw, in your ho
Slut out a freak
Hit her from the back, turn her bladder deep
Do the triple X when I'm in a freak
Boaw, boaw, knock a ho to her knee
Beat her back down, bitch tryna skeet
Bih, turn around, come suck the meat
Round for round, finna beat her 'til she sleep
Eat her pussy up, bon appétit
Take her back a day like I'm on a G
Slow it down, baby, ride me like a Z
Double cup, you gon' ride me straight to sleep
Two hoes tryna fuck me while I'm geeked
Blame it on the pill when she gettin' beat
Goin' ham on her when I give her D
Knowin' homeboy, I gotta keep it P
Gotta go home to bloody streets
Yeah, she gonna bump and bump and boom
She gonna make that booty move
I'm in that bih, got it ho in the mood
And we be geekin' like sun to the moon
We on some shit that we don't 'posed to do
One of my bro hoes came out the Ub'
I don't know, but that ho with the, ooh
Shit was leakin', ooh, juice
Shit was peachy just like the fruit
She say that that shit was fruit
I say that that shit was goose
I just beat that pussy loose
Knock them walls down, all I do
Hit that ho like one or two
Three, four, times that Addy, ooh
Made me
The Addy made me, the Addy made me, the Addy made me, look
The Addy made me do it like that, made me do it like this
I get behind your ho, right, I do the hitman position
And then I do like this (what you do slime?)
Boaw, boaw, boaw, boaw, boaw, boaw, in your ho, yeah
Boaw, boaw, boaw, boaw, boaw, boaw, in your ho (ugh)
Boaw, boaw, boaw, boaw, boaw, boaw, in your ho (ugh, ugh)
Boaw, boaw, boaw, boaw, boaw, boaw, in your ho (whoa)
Okay, she fine (21) she sexy, she cool (21)
She from East Atlanta, so she like to get loose (on God)
Casamigos (yeah, yeah), do some shrooms (21, 21)
But if you wanna come (21), give my brother some (yeah)
Bend over, come ride me like your Rover
All these VVS's, it get cold in Minnesota (21)
Suck me up, don't use your teeth, lil' bitch, I thought I told ya
She grabbin' my bandada while I hit 'cause I'm a soldier (21, 21)
Get freaky, she got a tattoo right by her bikini that say ""Eat me""
Top me in the Demon, while I hit the gas down Peachtree
Hit the club, throw a lot of money, baby, we be doin' that weekly
Shh, we gotta be sneaky (ooh)
Boaw, boaw, boaw, boaw, boaw, boaw (boaw, boaw, baow)
Boaw, boaw, boaw, boaw, boaw, boaw (boaw, boaw, baow)
Boaw, boaw, boaw, boaw, boaw, boaw (boaw, boaw, baow)
Boaw, boaw, boaw, boaw, boaw, boaw (what you do Slime?)
Boaw, boaw, boaw, boaw, boaw, boaw, in your ho, yeah
Boaw, boaw, boaw, boaw, boaw, boaw, in your ho (ugh)
Boaw, boaw, boaw, boaw, boaw, boaw, in your ho (ugh, ugh)
Boaw, boaw, boaw, boaw, boaw, boaw, in your ho (ugh)
Boaw, boaw, boaw, boaw, boaw, boaw (boaw, boaw, boaw)
(Boaw, boaw, boaw)
(Boaw, boaw, boaw)
(Boaw, boaw, boaw, baow)",2023,"Reggaeton, Latin Urbano, Alternative/Indie, R&B/Soul, Dance/Electronic, Pop, UK R&B, Hip-Hop/Rap, Rock, Country"
2023,El Azul,Junior H x Peso Pluma,True,"Qué detallazo pa' mensajear con la muerte
Una con siete chinos que de retrato trae
Al señor de la montaña, de los drones y demás
Cuernos del diablo junto a mi seguridad
Viejo lobo en verguiza para el polvo traficar
Dios siempre me cuida y mi gorrita de Elegua
En la sangre traigo el 701
Melena de león, pues vengo de uno
Siempre amafiado, pues no somos culos
Bajo perfil el chavalón y se le extraña
Aunque se fue, nunca se le olvida
Bélicos ya somos, bélicos morimos
Y con el corridón del ángel azul
A Dios le pido perdón por los pecados
Pero así es esto
Rolls-Royce azul
Que pa' la finiquera seguido ya han de brincar
Me enamoró el dinero, quiero, quiero y quiero más
Cuernos del diablo y un comando mi seguridad
Viejo lobo en verguiza para el polvo traficar
Dios siempre me cuida y mi gorrita de Elegua
En la sangre traigo el 701
Melena de un león, pues vengo de uno
Siempre amafiados, pues no somos culos
Bajo perfil el chavalón y se le extraña
A un Ruíz, el que nunca se olvida
Bélicos somos, bélicos morimos
Y con el corridón del ángel azul
Le pido perdón a mi Dios por los pecados
Pero así es esto
Translate to English",2023,"Latin music, Regional Mexican"
2023,"You, Me, & Whiskey",Justin Moore & Priscilla Block,True,"You've been doin' that nine-to-five straight line walkin'
Yeah, it's been a long time
Yeah, it's been a long time
Since I've seen that lettin' down your hair
Double-dog-dare look in your eyes
Oh, and you've been burnin' it at both ends
Been a hot minute since you flipped that switch
Girl, it ain't nobody's fault, let's shut the world off
And turn it back to when
It was you, me, and whiskey all night long
Sinkin' to the bottom of them country songs
Fire burnin' hot 'til the last drop's gone
Let's turn it up, turn it up
'Til we take that Black Label buzz too far
And say them things that stay in the dark
Ain't nothin' as sweet, ain't nothin' as strong
As you, me, and whiskey all night long
I see you still got that knock-it-back shot glass
Girl, you ain't missed a beat
You already let a little four letter slip
And your hands are all over me
And you're already talkin' dirty and it's only 10:30
We know where it goes from here
I can't find this me in a red wine glass
Yeah, and I can't find it in a beer
It's you, me, and whiskey all night long
Sinkin' to the bottom of them country songs
Fire burnin' hot 'til the last drop's gone
Let's turn it up, turn it up
'Til we take that Black Label buzz too far
And say them things that stay in the dark
Ain't nothin' as sweet, ain't nothin' as strong
As you, me, and whiskey all night long
Yeah, baby
Whiskey all night long
You, me, and whiskey all night long
Sinkin' to the bottom of them country songs
Turnin' this house to a honky tonk
Let's turn it up, turn it up
'Til we take that Black Label buzz too far
And say them things that stay in the dark
Ain't nothin' as sweet, ain't nothin' as strong
As you, me, and whiskey all night long
Yeah
Whiskey all night long",2023,"Latin music, Regional Mexican"
2023,IDK NoMore,Gunna,True,"I don't know no more, I don't know no more
I can't put my finger on it, I don't know who to call
We was never used to money, they don't know how to ball
They lookin' for me, let 'em know I'm buildin' a wall
Duckin' the law, I ain't trustin' no one at all
I know that when you shine they wish some days'll be dark
And I know there be a time you really show who you are
We burned the bridge and cut the ties and we forever apart
I'm done with all these foes on my soul, just forget 'em
Ten months without no syrup, ain't no more codeine in my liver
Why men actin' like girls, talkin' to niggas like they sisters?
And if you wanna roll you can go on the road with 'em
Lookin' through that peephole, better hope it ain't a hitter
I could do bad on my own, I'on't wanna fuck with niggas
Had a big brother that loved me, a stone cold killer
If it's family, that mean the love is never ever endin'
I don't know no more, I don't know no more
I can't put my finger on it, I don't know who to call
We was never used to money, they don't know how to ball
They lookin' for me, let 'em know I'm buildin' a wall
Duckin' the law, I ain't trustin' no one at all
I know that when you shine they wish some days'll be dark (I know that when you shine)
And I know there be a time you really show who you are
We burned the bridge and cut the ties and we forever apart
Niggas just stay mad, that there is really somethin' else to it
It's always been your plan, you just ain't have no way to do it
'Member we was cool? I gave you shit when I didn't use it
Lemme get that money back, I hope you ain't ran through it
Wanna know how Wunna feel? Then listen to my music
Talk about that shit and all that knowin' I was clueless
Real life on this type of shit, it feel like a movie
I feel I just don't know no more, what all else'll do me?
I don't know no more, I don't know no more
I can't put my finger on it, I don't know who to call
We was never used to money, they don't know how to ball
They lookin' for me, let 'em know I'm buildin' a wall
Duckin' the law, I ain't trustin' no one at all
I know that when you shine they wish some days'll be dark (I know that when you shine)
And I know there be a time you really show who you are
We burned the bridge and cut the ties and we forever apart
We burned the bridge and cut the ties and forever apart
And I know there be a time you really show who you are
They was never used to money, they don't know how to ball
They lookin' for me, let 'em know I'm buildin' a wall
(I know that when you shine)",2023,"Latin music, Regional Mexican"
2023,P Angels,Gunna,True,"I'm in Sky-ami, I'm back out the chain (yeah)
Took a few losses, that's part of the game (that's part of the game)
Boarded a big jet, took my talents to Spain (yeah)
I had to swerve, they was all in my lane (skrrt)
On a Tsunami, yeah, like wave
I bought the map (uh), Bruce Wayne (Bruce Wayne)
Sleep on the yacht for like twenty-somethin' days (twenty-somethin' days)
On a G6 tryna smoke all the Haze (smoke all the Haze)
I got P Angels, they pullin' up whisperin' (P's)
Breakin' down sixes, and geekin' and trippin'
I'm with the bad ones, the ones they be trickin' (the bad ones)
Y'all niggas laughin', we laughin' right with you (ha)
Only thing that matter is bigger picture
Want you get mad, try and send one your hitters (send one your hitters)
I know he mad he found out that I hit her (found)
Couple more baddies, let's order more liquor (let's order)
Kickin' my P, let these boys talk in pillows (kickin')
All in they mouth, I'm the motherfuckin' dinner (motherfuckin' dinner)
Come to my crib, you gon' need some credentials (come on)
Two or three gates pullin' up, ain't that simple (nah)
Factory AP, yeah, yeah (yeah, yeah)
I do business with the original dealer (original dealer)
Handle business, get on top of you niggas (on top of you niggas)
Hope Lord, forgive me, you know I'm a sinner (yeah)
The drip when I walk I'm a oil spiller (oil spiller)
I mixed the Marni with Margiela (Margiela)
Do my big one like Godzilla (Godzilla)
Caramel and redbone and some of them yellow (some of them yellow)
Had to whip out the card (card)
Keep the black card like a car dealer (dealer)
Push P like park (park)
Go back up to space out of Dodge (yeah)
I'm in Sky-ami, I'm back out the chain (yeah)
Took a few losses, that's part of the game (that's part of the game)
Boarded a big jet, took my talents to Spain (yeah)
I had to swerve, they was all in my lane (skrrt)
On a Tsunami, yeah, like wave
I bought the map (uh), Bruce Wayne (Bruce Wayne)
Sleep on the yacht for like twenty-somethin' days (twenty-somethin' days)
On a G6 tryna smoke all the Haze (smoke all the Haze)
I fuck some baddies four hours straight (yeah)
Pill came from Porn Hub, we fucked out the gate (yeah)
Hit the plantation, a millionaire estate (millionaire estate)
Geeked like the station back in the day (geeked)
I'm stayin' focused, get paid (get paid)
I bought a Lotus, Wale (Wale)
Ain't givin' warnings, clear the way (clear the way)
Paint on my watches the same color of spades (yeah)
Peace to Wunna, she don't wanna get saved
Nigga can't count how much money I made
Flew to the Yams, I got tired of the shade (gone)
I can't see nothin' in these new Prada shades (new Prada shades)
I'll send the cleaners I keep me a maid
I'm from the hood, still'll catch me a fade (catch me a fade, fade)
What's crackin', lil nigga? Let's get us a fade
Fuck all that bullshit, I went back to get it
I laid in Sky-ami, been a minute
I'm gon' get a GRAMMY, that's my witness
I want it, I get it independent
Took her some L's and still winnin'
Roll up an L, I'm so high, see the city
I locked her in 'cause she freaky and saditty
Pop back right out and I'm showin' up petty
I'm in Sky-ami, I'm back out the chain (yeah)
Took a few losses, that's part of the game (that's part of the game)
Boarded a big jet, took my talents to Spain (yeah)
I had to swerve, they was all in my lane (skrrt)
On a Tsunami, yeah, like wave
I bought the map (uh), Bruce Wayne (Bruce Wayne)
Sleep on the yacht for like twenty-somethin' days (twenty-somethin' days)
On a G6 tryna smoke all the Haze (smoke all the Haze)",2023,"Latin music, Regional Mexican"
